Type,Annual_Utilities,Cleaning_Laundry,Maintenance_Repairs,Insurance,Platform_Fees_15pct,Property_Tax,Total_OPEX
Yurt (Shield Dome),1800,3600,1500,2000,6600,800,16300
Barndominium (Mead Hall),4000,6000,4000,4500,11925,2000,32425
Quonset Hut (Iron Longhouse),3500,5500,3000,3500,7310,1500,24310
Geodesic Dome (Odin's Eye Dome),2000,4000,1200,2200,13140,600,23140
Tiny House (Viking Cabin),3000,4500,2500,3000,11925,1500,26425
Safari Tent (Raiders' Pavilion),1500,3000,2000,1800,7310,400,16010
FEMA/Military Tent (Traveler's Shelter),1000,2500,1500,1200,13140,200,19540
